{
    "$schema": "https://json-schema.org/draft/2020-12/schema",
    "title": "Audit Log",
    "description": "An Audit Log gathers the necessary data to audit a Transaction (via Transmission) for a given Addressable Content",
    "$id": "audit-log",
    "type": "object",
    "additionalProperties": false,
    "properties": {
        "version": {
            "$ref": "version.json"
        },
        "data": {
            "$ref": "ids-and-preferences.json"
        },
        "seed": {
            "$ref": "seed.json"
        },
        "transaction_id": {
            "$ref": "transaction_id.json"
        },
        "transmissions": {
            "description": "The list of Transmission Results that participated to the generation of the content. This list is chronologically ordered.",
            "type": "array",
            "items": {
                "$ref": "transmission-result.json"
            }
        }
    },
    "required": [
        "data",
        "seed",
        "transaction_id",
        "transmissions"
    ]
}
